issue_key	project	issue_type	summary	description	comments	design_prob	Label
FAB-17852	FAB	Story	"""Production Network Testing"""	"""""""A blockchain is meant to be a pseudo-immutable, everlasting ledger. It is meant to run forever, without ever coming offline, and never experiencing downtime.    To that end, as System Test, we will test a network by running in a manner consistent with the expectations we have of our consumers running their networks in production. This include monitoring, alerting, scaling, upgrading, trafficking, and maintaining the network just as our consumers do. We will encounter the same issues our consumers experience, such as storage size, and deal with them in the same manner our consumers do.    The intent is that this network should never stop running. By doing this, we will be able to better understand the UX of our consumers and help drive out technical challenges they face, all while asserting that our software behaves in a manner consistent with its intended design.    Outputs of this work will include documentation for features, maintenance, etc., as well writing user stories from our experience to drive new work in Fabric UX."""""""	"""Network is deployed to community-longrun cluster, scheduled a daily run to send invokes to production network and it is running at https://dev.azure.com/Hyperledger/Fabric-Test/_build?definitionId=108&_a=summary"""	0.9940339	
FAB-15229	FAB	Sub-task	"""Service discovery needs to support channel config policy references"""	"""""""The chaincode definition in the new lifecycle requires:    an admin of an organization to define the chaincode for peers in the organization  an admin of a channel to invoke an endorsement on the lifecycle chaincode in order to collect the """"""""votes"""""""" of step (1) and then send a transaction with these signatures (of the admins of all organization).       Step (2) is governed by an endorsement policy that is a meta-policy, which can be either a signature policy, or a quantifier predicate of meta-policies such as - all, any, or majority.    If we expand service discovery to support meta-policies, we can have SDKs know the peers to send endorsements for step (2) via discovery endorsement queries."""""""		0.99304986	
FAB-14605	FAB	Story	"""As a client to a Fabric Network I shouldn't have to assume defaults"""	"""""""I'll use the concrete example that sparked this. I'm sure there are others.    A fabric network defines the maximum permissible message size at creation time.     As a client - regardless of SDK - a user ought to be able to determine the maximum message size allowed by this network so they can configure my client access methods appropriately.    Currently this is left to the individual SDK implementations rather than being specified by the network owner. It would be far more convenient if it were returned by a network configuration call so clients can act on it - and set their own connection values - appropriately.    This is especially true when the network is managed by a third party and access to configuration is limited.     """""""	"""Stale"""	0.99289846	
FAB-17111	FAB	Story	"""Separate client and cluster facing ports on peers and orderers"""	"""""""TLS makes load balancing for peer and orderer nodes difficult to implement. Without TLS, many transparent load balancing mechanisms just work out of the box, for example Kubernetes services.    It would be beneficial to separate client and cluster facing ports on peers and orderers, so TLS  can be enabled on those ports separately.    Generally client applications and relevant Fabric peers and orderers run in the same trusted environment where TLS is not a security requirement. In contrast. disabling TLS have benefits for scalability and availability.    This is related to FAB-15648    In addition to discussion in that ticket, re-thinking suggests, TLS termination proxies wont help in mixed environments, where some peers/orderers are behind a TLS termination proxy some other not. So, as it's now, in a mixed environment TLS should be enabled network wide which will prevent transparent load balancing.     """""""	"""[~<USER>        [~<USER>     [~<USER>    What do you think? This looks like a natural extension to FAB-15648"" [SEP] ""{quote}TLS makes load balancing for peer and orderer nodes difficult to implement.  {quote}  The whole point is that Fabric does this load balancing for you in every layer - starting from the SDK and concluding in the peers / orderers.       {quote}Without TLS, many transparent load balancing mechanisms just work out of the box, for example Kubernetes services.  {quote}  I don't think that it makes sense to run Fabric in production without TLS.    Fabric is a Blockchain and as such it is supposed to be used across different organizations that don't trust each other and they always move around sensitive and confidential data.   It's true that you can run the nodes in some service mesh that does the TLS termination for you like Istio, but why would you do that if Fabric manages TLS for you, for all the organizations in the network?       {quote}In addition to discussion in that ticket, re-"	0.9922299	
FAB-17279	FAB	Story	"""Service discovery should consider collection-level endorsement policies"""	"""""""In v2.0 an option to specify endorsement policy at collection level is added. Therefore service discovery for endorsements at collection level also needs to take the collection level endorsement policy into consideration.    This will require an API to get endorsement policy given chaincode and collection name."""""""	"""This shouldn't be too hard, as discovery simply relies on a one method interface:      To retrieve the endorsement policy and the collection config.   If we extend it to have a collection (or an empty string if no collection) parameter as well which puts in the endorsement policy in the Metadata the EP according to whether the collection level EP is set or not, then things should work, as long as the current code works properly.     I'll try this approach and see where it gets us."" [SEP] ""https://github.com/hyperledger/fabric/pull/445   [~<USER> I need someone to work its way from the fabric lifecycle side... """	0.99212486	
FAB-15710	FAB	Story	"""Design & implement channel participation REST API - Join, Remove, and List channels"""	"""""""With FAB-15708 and FAB-15709 implemented, an orderer can start without any genesis method, or any channels defined, but does nothing.      We need an API to be able to:    * Join this OSN to a new or an existing channel,  * Remove this OSN from an existing channel,  * List the channels this OSN is a member of.    This story is dedicated to the detailed design and implementation of the REST API of this feature, with the underlying behavior described in epic FAB-17712 and associated RFC. The REST API implementation will accept the queries defined and will transfer them to an abstract interface of the underlying implementation.    The first product of this task is a design document.    The REST API design is [HERE|https://docs.google.com/document/d/1kYoicS_Z59gNvmuuB7VFZ6WsOL31C34dWMeOFQiIygA/edit?usp=sharing]."""""""	"""[~<USER> [~<USER> Could you please review the design document?"""	0.99203557	
FAB-16175	FAB	Sub-task	"""Define hook for alternate validation of endorser transactions"""	"""""""Historically, transactions in fabric could be validated by system chaincodes and later by go plugins - both of which aimed to be plug points so that alternative validation of endorser transactions could be defined. System chaincodes and go plugins are now being removed, and so the pluggable nature of validation should at least be preserved by defining a clear interface and using the """"""""validation"""""""" field of a chaincode definition as a way of determining the correct implementation of that interface.    Alternatively, we could say that alternative validation of endorser transaction doesn't exist, we can only validate differently a different type of transaction. In this case, there is no need to even  have a field to store the alternate name of the system chaincode/plugin."""""""		0.99196285	
FAB-17663	FAB	Story	"""Implement function to update a consortium group's channel creation policy value"""	"""""""As a consumer of the fabric config API, I would like to be able to update the channel creation policy value in a consortium.    We don't support configuring it at channel creation time because it governs the validation of the channel creation request so allowing the channel create tx to set the value would defeat the point; however, we want to be able to allow consumers to update this value on config updates. Note that this is not a ConfigPolicy but rather a ConfigValue in a specific consortium group.         *Acceptance*    I can call the function to update the default channel creation policy value in an existing config. An example should be added to the example_test as well."""""""	"""https://github.com/hyperledger/fabric/pull/929"""	0.9916917	
FAB-15413	FAB	Sub-task	"""Complete service discovery integration tests for the new lifecycle"""	"""""""There are 3 integration test scenarios for service discovery         but [https://gerrit.hyperledger.org/r/#/c/30994/] only covers the first scenario in the new lifecycle. This sub-task tracks the work required to investigate whether the 2nd anr 3rd scenarios are relevant to the new lifecycle and whether we should code tests for them or not.     """""""	"""FAB-15222 now incorporates _lifecycle in the first two tests(""""channel information"""" and """"peer membership""""). The third test is for another aspect of service discovery that is unrelated to lifecycle and chaincodes, so I've left it as-is. """	0.99154985	
FAB-17308	FAB	Story	"""Discovery should support private data blind writes"""	"""""""Currently, when a client queries discovery with an endorsement query which has collections in the query, discovery intersects the available peers with the collection definition by removing peers which are not part of the collection since they do not have the pre-images required to read from the namespace.    However, the introduction of *GetPrivateDataHash* makes new use cases possible, namely scenarios where some of the endorsers of a transaction aren't in the collection, but they are fed with the pre-image via other means (e.g the transient field) and after validating the pre-image using *GetPrivateDataHash*, they can perform the same computation as peers that are in the collection. In such a case, discovery will filter out those peers needlessly.    Furthermore, we want to be able to support writes to collections that have their own endorsement policy, while at the same time the membership of the collections might not even intersect (e.g if we have an org specific collection and we want to delete a key from collection """"""""orgA"""""""" and write it into collection """"""""orgB"""""""").    The above use cases require the ability to convey to discovery not to filter out peers based on collection association.    Additionally and independently, we sometimes want to do a chaincode-to-chaincode transaction where some of the chaincodes are used for read only, and then we don't want to take into account the endorsement policy, however it can be useful if discovery would still be aware of this so it can filter out peers that do not have the chaincode installed.    To support all the above, I propose to add 2 new flags (3 and 4 below) in the [ChaincodeCall|https://github.com/hyperledger/fabric-protos/blob/master/discovery/protocol.proto#L156] protobuf message:    Adding these 2 booleans will preserve backward compatibility to Fabric versions 1.4 and below, but will enhance the expression power to support more use cases.         [~<USER>"""""""	"""https://github.com/hyperledger/fabric/pull/538"""	0.99142015	
FAB-16181	FAB	Sub-task	"""Define a strategy for changes in validation that need capability checks"""	"""""""Any changes to the validator component that alter its behaviour must be gated by capabilities. There are currently 3 approaches on the table  # fork the validator and use the appropriate one given the capability  # maintain if/then/else switches that consider the capability  # use function pointers    All have their shortcomings, and fabric has adopted all of them inconsistently in different components. We must design a proper approach to handle this and use it throughout."""""""	"""[~<USER> I think we concluded that forking is acceptable for large validation refactorings, while we can use if/then for very small changes.   Many people have difficulty reading function pointer code, so in my opinion its not a good choice for the most critical piece of code in an open source project."""	0.9913368	
FAB-15711	FAB	Story	"""Allow the orderer to Join channels"""	"""""""This story is dedicated to the functionality of joining channels using the channel participation API.    If the orderer does not have a system channel defined, it should be able to join application channels.    If the orderer does have a system channel defined, it should not be able to join any other channels.    If the orderer does not have any channels defined, it should be able to join any channel, including the system channel.    The orderer should be able to join as a cluster member (included in the consenters set) or as a follower (not included in the consenters set).  The orderer should allow a transition from a cluster follower to a cluster member and vise-versa."""""""		0.99133587	
FAB-16182	FAB	Story	"""Improve validation flow: Simplify dependency on CollectionStore in gossip"""	"""""""We don't use CollectionStore anywhere else besides in the Puller/Fetcher and for getting AccessPolicies for determining ineligibility. Lets break up CollectionStore into two interfaces, one for providing a SimpleCollection and one that SimpleCollection will implement similar to the existing CollectionStore interface. We can also rename CollectionStore since it's not reflective of what the interface is used for."""""""	"""After some discussion with [~<USER> we've decided that this work is too much effort and not required for the validation path refactor to do at this moment. Throwing this back in the backlog to address in the future. Some considerations we talked about were that we want to pass around a real SimpleCollectionStore that wraps the QueryExecutorFactory, ChaincodeInfoProvider, and IdentityDeserializerFactory, but all of the existing tests in coordinator and puller are reliant on mocking the CollectionStore interface. Making any minor changes to the interface or pulling anything into a real breaks the entire structure of how the tests are organized right now and refactoring the tests has become a large scale endeavor."" [SEP] ""Some initial attempts in [https://gerrit.hyperledger.org/r/c/fabric/+/32861/1] and [https://gerrit.hyperledger.org/r/c/fabric/+/32854/1]"""	0.991089	
FAB-17160	FAB	Story	"""As a fabric deployer, I want to avoid any docker requirements in my deployment"""	"""""""With the introduction of external builders, docker should no longer be necessary.    To ensure that's true and that it remains the case, implement an integration test that explicitly removes any docker configuration from the peer and uses the binary builder in our integration tests to run an end-to-end scenario."""""""	"""when peer starts, we still have Docker setups in place, and we do fall back to Docker build when external builders are not available (or error out?).    do we want to change that behavior to """"if {{vm}} is not specified, disable docker completely""""?"" [SEP] ""[https://github.com/hyperledger/fabric/pull/384]"""	0.9910313	
FAB-15630	FAB	Story	"""In the CC2CC scenario, provide a method for the callee CC to obtain the caller CC's name, similar to Eth's msg.sender"""	"""""""In many CC2CC scenarios, the callee needs to know and verify the caller's information. For example, in the implementation scenario of an oracle, the oracle CC accepts calls from the business CC and writes the URL access results back to the business contract in a callback. In the callback function, the business CC only trusts callbacks from the oracle CC.  At the moment, due to the lack of the ability to obtain the caller's information, the oracle logic can only be placed in the same CC as a function library . Such an implementation brings troubles in the monitoring and processing of business events and oracle events."""""""		0.9909473	
FAB-17043	FAB	Documentation	"""Add performance measuring strategy to Documentation"""	"""""""Add an overview of a performance measurement strategy and point to https://hyperledger.github.io/caliper-benchmarks/content/fabric-performance/approach/"""""""	"""On the doc work group call this morning we talked about how we could best do this:   # Concepts, Tasks and Reference as framework. Useful concept material can be in Fabric Docs.  Reference should refer  to Fabric Performance Site.  Thoughts required on Task material – i.e. how to use.   # Wait for 2.0 and RAFT to document work as best advise.   # Q1 timeframe for new Performance topic."""	0.99094325	
FAB-16381	FAB	Task	"""Health check mechanisam to verify for the active containers in PTE"""	"""""""Add a health check mechanism in PTE to check the active status of the containers.  Existing PTE long run tests, keeps sending traffic to the end points irrespective of the status of the containers. Take an example of 12 hr long run test,    After 1-2 hrs if the containers are stopped/crashed, then the PTE keeps sending the transactions till 12 hrs. This approach consumes system resources unnecessarily till the completion of the test. Instead of that, if we implement a mechanism of checking the health of the docker containers frequently while the test is running."""""""	"""This is what I am thinking to implement this task in PTE.    While the PTE is client is sending transactions to the network, we have to launch an another thread to perform health check (Check whether the containers are up and running or not with for every 15 to 30 mins interval). This thread has to stop the running PTE client.    The above step avoids sending false transactions to the network even though the network is not ready to accept the transactions. This avoids unnecessary billing when running network on a cloud instances where every sec is important from billing POV.    cc [~<USER> [~<USER>"" [SEP] ""Implementation would be complicated, depending on usecase. Cost savings not significant."""	0.9907398	
FAB-15011	FAB	Documentation	"""Augment Raft leader election section to include how and when new leader elected"""	"""""""Noticed that the section on leader election for Raft does not indicate that leader election happens periodically and can be configured. Important to know so that people understand that ordering service cannot be easily compromised.         https://hyperledger-fabric.readthedocs.io/en/release-1.4/orderer/ordering_service.html#how-leader-election-works-in-raft"""""""	"""At least in the v1.4.1 implementation of Raft, we have no notion of leader 'spinning' or similar.  Leader election happens per the standard etcdraft protocols, and leader is changed proactively only for safety during reconfiguration."""	0.9907355	
FAB-18048	FAB	Story	"""Implement function for adding/removing consenters from an etcdraft orderer configuration"""	"""""""As a consumer of the fabric config API, I would like to call a function for quickly adding or removing consenters from the consenter set of an etcdraft orderer configuration. Currently this is already achievable via fetching the entire orderer configuration and setting a new orderer configuration with the consenters updated, but the addition of these API functions will reduce the need for overriding the entire orderer configuration. Note: removal should match all 4 fields (host port and both certs) to be safe.    *Acceptance*    I can call functions to add and remove consenters from an etcdraft orderer configuration similar to how I can do so for orderer endpoints of an orderer org and anchor peers of application orgs."""""""	"""[https://github.com/hyperledger/fabric-config/pull/32]"""	0.9907232	
FAB-14799	FAB	Sub-task	"""Add metrics to indicate active nodes for raft"""	"""""""This task is to add a metrics {{ActiveNodes}} to indicate number of active nodes from leader's pov.    This info is available on leader *only*, but we could disseminate it to followers by piggybacking heartbeat messages (in its context field).    This is particularly useful in a multi-org setup, where Prometheus server in leader org is not always accessible for other orgs. Another benefit is that operators don't need to identify leader before gathering this metrics.    Note that if a node is partitioned, this metrics should be cleared, as it doesn't make any sense. This can be done if node starts election (becomes candidate).    However it does involve adding protobuf message in an extensible way. Design decision at this point of release is scary.    My suggestion is to add this metrics to leader only, and we could always extend it to be shown on followers without breaking compatibility.    pls chime in [~<USER> [~<USER> [~<USER>"""""""	"""I think that adding it to the leader is not that intrusive, but we shouldn't piggyback this into the heart-beats. "" [SEP] ""[~<USER> How would you ultimately address the need for multiple orgs to monitor Raft health without either a) requiring that the orderer operations endpoint be opened across orgs b) that the prometheus server scraping the endpoint be opened across orgs?"" [SEP] ""they can either look at the logs, and we do log there errors and warnings, or we can add metrics for transmission errors... what do you say? "" [SEP] ""I might have missed something but the last time around we were discussing about this there was no reliable way of figuring out the number of active nodes. Do we plan on using the heartbeats from followers at the leader for this? I believe [~<USER> had some problem with this approach back then.      Also, I am curious about why just knowing about the leader is not enough from an operations standpoint? If an admin observes that the cluster is leaderless for a long time (we can do so by"	0.9906901	
FAB-14235	FAB	Test Task	"""4. Raft Stress and Robustness - Send blasts of transactions to orderers, sometimes while restarting orderers (maybe create thundering herd scenario)"""	"""""""With several tests in 1.4, we have run traffic with over 100 threads to generate simultaneous burst of messages at the start of large traffic tests - with many orderers and with many channels. So this has been tested to some degree already.    The restarts test FAB-14220 stopped and restarted multiple orderers at once, causing leader changes, with traffic running. Once the channel reelected a leader, all the orderers were able to start handling transactions again. The PTE-generated traffic resumed simultaneously. These transactions included some already endorsed, and then others would follow soon on the numerous threads concurrently after those inflight transactions were broadcast to the orderers.    To really generate a more extreme burst of transactions to an orderer as soon as it recovers, or to all orderers as soon as a leader is elected in a channel, we could try these ideas:   * use PTE - but only after we modify it to queue up multiple transactions per thread that are NACKed by orderers (because of lack of leader - or maybe even also those that were dropped, for which we simply did not receive events) and continually reattempt to resend all of them. Is this feasible?   * use OTE (FAB-14232) - but only after we modify it to continue to send heavy stream of endorsed transactions with no hesitation even when transactions are NACKed by orderers   * use HFRD (FAB-14231), since it uses lots of threads naturally, with enough peers to share the endorsement load, and blast the orderers with traffic; possibly restart a leader and/or other orderers to test recovery and stability"""""""	"""Logistics of doing this requires manipulating test environment.    Live network applications would require connections to be established and message acknowledgements."""	0.99060106	
FAB-17033	FAB	Story	"""Compare readset values during commitment"""	"""""""As a user  I want a transaction to be invalidated if an endorsing peer has tampered read set  So that tampered data is not propagated among other peers         The read set contains only the keys and the versions of the data read during chaincode execution. Thus if the world state of let's say single endorsing peer was tampered, all peers will commit an updated invalid value. On the other hand, if along with the versions there were values in the readset, the peers could compare them with their own and discard a transaction if needed.    the use case is well described in the article     [https://medium.com/@kctheservant/exploring-the-behaviour-of-hyperledger-fabric-when-world-state-is-tampered-764676fe90f2]"""""""	"""Please let me know what you think!     "" [SEP] ""The entire point of requiring endorsements from multiple organizations is to ensure that one bad peer cannot cause these types of problems.  If the design above were implemented, the result would be a fork on the 'bad' peer that would only continue the problem.  Closing."""	0.9905137	
