issue_key	project	issue_type	summary	description	comments	design_prob	Label
FAB-16336	FAB	Task	"""launch pte threads processes inside k8s cluster"""	"""""""Launch pte threads processes inside k8s cluster containers instead of on local machine wherever tests are started (which may be a small capacity VM). Doing this should increase performance significantly, or at least eliminate a potential bottleneck that could prevent stress load testing.    Integrate this option into the k8s launcher tool to be done automatically. Document this appropriately. Also, ensure the user can see the pte logs.    This will require retrieving data from all the pte containers to be put together and reported at the end of the test.    It also may be easier after standardizing a report structure with FAB-16167."""""""	"""Marking this as a future work."""	0.9875293	
FAB-17851	FAB	Story	"""Chaos Testing"""	"""""""Some of the fundamental properties of a Blockchain network, are its highly-availability, fault-tolerance and ability to recover from disaster. To that end, one of chief goal as System Test should be to fully test the ability of a Fabric network to recover from minimal and total failure. Our goal should be to assert the expected functionality of the network as we kill off components and allow them to come recover, delete the underlying artifacts of these components, and take them offline for extended periods of time.    This testing will be performed using ChaosKube on a Kubernetes cluster."""""""		0.98747694	
FAB-16485	FAB	Task	"""In fabric-test, remove dependencies on chaincodes and artifacts in other repositories"""	"""""""The goal is to make our test environment self-sufficient and more stable, not to test other chaincodes such as those in fabric-samples or fabric repositories. If a cc exists in another repo, that other repo owns it and should have their own tests to verify it works.    Review current cc usage for all tests inside fabric-test, and if necessary create our own chaincodes that exercise the logic funtionality desired, or make local copies in fabric-test/chaincodes/. We don't want our tests to break when the test chaincodes get changed by others.    An argument could be made for exceptions for marbles02 and marbles02_private, which are fully supported by fabric team (currently and intended to provide full API coverage and expect to be maintained continually; we could consider using these from remote repositories (currently fabric-samples). Discuss with the leads as appropriate. However, even for these, it may still be preferable to contain local copies within fabric-test repo. If for some reason the cc evolves, then we could update our own copies and fix our tests together in a controlled manner at aa convenient and appropriate time, to avoid unexpected test failures and CI disruptions."""""""	"""This work was completed as part of general cleanup"""	0.9874507	
FAB-16109	FAB	Story	"""As a fabric developer, I need a way to detect when an externalbuilder chaincode has exited"""	"""""""There is a function 'Wait', in the current VM container API for chaincodes which is to allow the peer to monitor a running chaincode and, on its exit, deregister it from the map of chaincode handlers.  Presently, the externalbuilder implements this as a no-op {{select{ } }} waiting forever, as there is no way to determine the status of the chaincode.    It's unclear whether we want to implement this as a synchronous blocking call like 'Wait' before, or whether we want to use some health check mechanism etc., but if a chaincode terminates abnormally, as it stands today, the externalbuilder will never restart it."""""""		0.9874287	
FAB-17709	FAB	Story	"""Implement function for creating system channel genesis block"""	"""""""As a consumer of the fabric config API, I would like to be able to create genesis blocks for system channels. As a reminder, system channel genesis block does not create an application group and instead only fills the channel config group with an orderer and consortiums group. Whether we choose to combine this function with application channel creation like what was done in the original configtx encoder, or we choose to split them into separate API functions is up to the implementer.         *Acceptance*    I can call a function to create a system channel genesis block. There should be a new example added that demonstrates this behavior."""""""	"""[~<USER> I forgot at the time of creating this story that this should be a genesis block and not a channel creation tx. System channel creation is tied to creating an actual block itself. There's examples of this in configtxgen"" [SEP] ""[~<USER> Thank you very much for reminding."" [SEP] ""https://github.com/hyperledger/fabric/pull/1055"""	0.98736143	
FAB-18069	FAB	Sub-task	"""Separate internal & external Halt on etcdraft.Chain"""	"""""""currently, when the etcdraft.Chain halts, either internally or externally, it calls an """"""""haltCallback"""""""" that generates a new chain. This is useful for internal halt, when the chain discovers it is no longer a member of the channel and needs to transfer responsibility to either a follower or an inactive chain. In order to remove a chain, we need to close it by calling Halt with an external thread. However, currently this will cause a call to haltCalback...    The task here is to separate internal halt (called by the internal go-routine) from external Halt, that should stop the chain and indicate that haltCallback should NOT be called upon termination."""""""	"""https://github.com/hyperledger/fabric/pull/1628"""	0.9873152	
FAB-17583	FAB	Task	"""Simplify NewCreateChannelTx to only consider an application channel"""	"""""""An application channel only needs to specify the consortium name, org names, and application level values/policies. We shouldn't need to extend it with defining org specific values/anchor peers/orderer config, etc. Currently the NewCreateChannelTx considers creation of a system channel and also creates a creates a Consortiums group and orderer group. Let's consider system channel creation for the future and simplify the existing logic to just be for new application channels."""""""	"""[https://github.com/hyperledger/fabric/pull/800]"""	0.9872914	
FAB-15946	FAB	Story	"""As a consumer of fabric-protos, I expect go language bindings to be available in fabric-protos-go"""	"""""""When protobuf definitions are updated in {{fabric-protos}}, an automated build process should be triggered to compile the protos to go and commit the generated artifacts to a separate source repository that gets used by or vendored into consumers. The {{fabric-protos}} repository will not contain the generated language bindings.    We have a couple of options to discuss for placement:    1. Create a {{fabric-protos-go}} repository to contain the compiled protocol buffer bindings for go. In this scenario, the import paths for the various protobuf packages would be {{github.com/hyperledger/fabric-protos-go/[common,discover,peer,orderer,etc]}}. This repo should be configured not to accept pull requests. The contents should be managed by automation.(Preferred.)  -2. Reuse the {{fabric-lib-go}} repository. In this scenario, the import paths would all be under a common {{protos}} folder and would be {{github.com/hyperledger/fabric-lib-go/protos}}.-    In either case, pull request builds for {{fabric-protos}} should generate but *not* merge/commit the artifacts to the target repo. Builds performed post-commit should generate the artifacts and commit them to the target repo.    Update: During IPM we decided to do the build and promote with Travis-CI.    [1:] Please consider branching strategies. {{fabric-protos/release-2.0}} should promote to {{fabric-protos-go/release-2.0}} while {{fabric-protos/master}} should promote to {{fabric-protos-go/master}}.  [2:] Please read https://medium.com/namely-labs/how-we-build-grpc-services-at-namely-52a3ae9e7c35 for inspriation.    """""""		0.9872738	
FAB-16206	FAB	Story	"""External builder detect should not need to parse flags"""	"""""""The first pass of the detect, compile, launch infrastructure was implemented with a collection of  command line switches. This will become unwieldy over time as implementers will have difficulties ignoring unknown flags and parameters - especially flags that accept values.    Instead we should remain consistent with the buildpack model that already exists - namely, we provide a list of directories that contain extracted files. If we need to provide more data, we can add an additional argument or populate additional files. This means that implementations should ignore extra arguments as a general rule until they know what they point to.    detect should be provided a directory containing metadata.json (holding metdata as a basic map) and a reference to a directory containing the exploded source.    Acceptance: external scripts do not need to process flags; existing parameters are reworked to fit this model."""""""		0.9872433	
FAB-14250	FAB	Sub-task	"""Integration tests for crash and recovery in the middle of migration"""	"""""""# A test case for the restoration of migration status after crash (""""""""empty kafka""""""""):   ## start a single Kafka orderer, perform a series of migration commands, but not commit.    ## stop the node and restart it, verify that migration can proceed.   # A test case for consuming fast from Kafka, possibly out of order (""""""""full Kafka""""""""):   ## start three Kafka orderer, perform a single migration command (START)   ## stop orderer 3   ## perform a series of migration commands, including commit on orderers 1,2   ## restart orderer 3   ## restart all (1,2,3) ro Raft   ## verify all is well"""""""	"""Switching to alternative  migration design - v2"""	0.98724014	
FAB-15782	FAB	Story	"""Fabric Samples Builds Chaincode Inside Fabric Tools Image"""	"""""""Currently Fabric Samples creates a CLI container from the Fabric-Tools image. It mounts the chaincode inside the container and calls `peer lifecycle chaincode package`.    Fabric recently merged a change that removes the shim and protos package from the ccenv image. This means that the shim, peer protos and their dependencies must either be vendored in the chaincodes package, or exist in the GOPATH. We also removed the filter that excluded the Shim and Protos package from the `chaincode package` """"""""autovendoring"""""""" process.    The issue in Fabric Samples is that the Chaincode is mounted into the CLI container where there is no hope of Fabric existing. Fabric cant be cloned locally inside the container before calling the package process because the directory is already populated by the cryptographic material. And Fabric can't be mounted into the container because the GOPATH could potentially contain multiple paths, i.e., `/usr/go:/usr/local/go:/Users/user/go` unless you first discern where Fabric exists on the GOPATH before mounting the volume.    The Fabric Samples team needs to come up with a solution that will allow for the existence of Fabric, whether that be inside the container on the GOPATH, or, packaging the chaincode outside of the CLI and then mounting the chaincode package into the container, which requires Fabric to be on the local GOPATH. We already require the users to have the binaries on their system PATH as part of the Fabric Samples prerequisites, so building it outside the container is not an unreasonable things to ask.    Fabric's new chaincode packaging model will require the dependencies to be prevendored, or exist on the GOPATH, so having developers who are running Fabric Samples have to do the same process is reasonable, given it will be expected of them when developing.    We will also need to update Fabric Samples doc to inform developers they need to clone Fabric into their GOPATH locally, if samples doesn't provide another means for packaging the chaincode.    You can test this issue by simply running ./byfn.sh up. However we have backed out the changes which cause this to break. We will reintroduce the changes, but gate them with a environment variable `CHAINCODE_VENDORSHIM` which if set to true will take the path that breaks the packaging process. You will be able to test your changes by setting this flag in your environment, whether that be locally outside of Fabric Tools, or in side of the Fabric Tools container."""""""	"""The strategy here will be to use Go modules functionality by adding a go.mod to each Go chaincode sample.  After that, we'll add a *go mod vendor* command to the various scripts"" [SEP] ""https://gerrit.hyperledger.org/r/c/fabric-samples/+/32064"""	0.9872204	
FAB-17782	FAB	Sub-task	"""Deploy Network"""	"""""""Deploy a network using a pipeline with the following topology on the network, we will reset this network weekly:   * 2 orgs   ** 2 Peer's per org   *** 1 CA per org   *** Use CouchDB   ** 5 Raft Orderers    We should install and instantiate a simple Go chaincode on the Chaos network such as samplecc. This chaincode will serve no purpose other than to drive traffic, so it need not be anything fancy.    This network will be redeployed weekly so it needs to be a pipeline and the artifacts need to be saved as a common name in Artifactory we can reference in the pipeline that will drive traffic."""""""		0.987211	
FAB-15599	FAB	Sub-task	"""QueryNamespaceDefinitions should return aggregate info from old and new lifecycle"""	"""""""The new version of the query should return info from both the legacy and the new lifecycle. The new lifecycle returns this    but the corresponding LSCC query (LSCC.GETCHAINCODES) returns    We have 2 options:   # change the query results of the new lifecycle to make them compatible (in terms of returned information) to the old ones, and then simply use the results of LSCC.GETCHAINCODES to fill info for the legacy lifecycle   # keep the current semantics of the query, and return similar info for the legacy lifecycle.    We need to apply appropriate shadowing rules so that if a chaincode is present on both lifecycles, information from the new lifecycle shadows that from the legacy.    We also need a flag to tell which of the chaincodes is currently defined in the new or the legacy lifecycle."""""""		0.9871832	
FAB-15476	FAB	Story	"""Reduce CouchDB exposure via reuse """	"""""""In the core/ledger package, lockbasedtxmgr current uses a new instance of CouchDB for every single test executed. Instead we should use one Couch container, and instead initialize new ledgers in the same DB.    This will provide two benefits:    The first is we reduce the likelyhood of a timeout occurring on CouchDB startup. Currently there are over 30 instances of Couch starting and any one can cause unit tests to fail. Using only one instance greatly reduces our exposure to failures.    The second benefit is a greatly reduced time period for conducting tests in this package. Each container takes 10 seconds to start. Reducing to a single container will save nearly 5 minutes off of unit test run time."""""""	"""https://gerrit.hyperledger.org/r/c/31417/"""	0.9871159	
FAB-14221	FAB	Test Task	"""5. Raft Quorum Tests: stop multiple orderers (some or all) to prevent consensus quorum, and then recover them, in different sequences, with traffic"""	"""""""We have covered this at some level with FAB-14220, which became a better test than originally designed, where we stopped/restarted different number of and combinations of orderers. What that test does NOT do is, after some orderers are stopped, to start (only) different subsets orderers (rather than starting all of them at once) to bring up the total number to be just enough to reestablish quorum (with different set of orderers that had been part of the most recent quorum). This is targeting functionality that is part of the raft logic, not so much our orderer code, so it does not have to be in the critical list for this fabric release but still is something we could execute to be thorough. We might also consider doing this along with FAB-14293, when we set up orderers in different clusters in distant locations."""""""		0.98710257	
FAB-15364	FAB	Sub-task	"""Allow system chaincode (at least _lifecycle) to have access to txsimulator/txcontext"""	"""""""System chaincodes are limited by the shim interface and do not have access to some of the resources that may be required in the downstream code.    FAB-15363 requires the _lifecycle system chaincode to query lscc system chaincode in order to fetch existing collection configs (if defined).    One possible way would be to use chaicode calling chaincode mechanism. However, that would be extending the uses of system chaincodes in the peer code even further.     The other way (which would be preferred) is to use https://github.com/hyperledger/fabric/blob/master/core/scc/lscc/deployedcc_infoprovider.go to query directly lscc without going via lscc system chaincode interface (as is used at many places in peer code). However, this requires _lifecycle system chaincode to have access to query executor that can be used directly.    Discussed potential solution with [~<USER> and he suggests that the _lifecycle system chaincode can be passed with the txcontext map during construction of the chaincode instance (https://github.com/hyperledger/fabric/blob/master/internal/peer/node/start.go#L327) and the chaincode can look this up by txid (which is accessible via shim). This appears a reasonable workaround to me till we have to manage a part of the peer code as system chaincodes."""""""	"""https://gerrit.hyperledger.org/r/#/c/31351/"""	0.9870688	
FAB-18086	FAB	Sub-task	"""Wiring between multichannel.Registrar, follower.Chain & BlockPuller"""	"""""""Currently several opaque function pointers are used to decouple the multichannel.Registrar and the follower.Chain.    Convert opaque function pointers to well defined interfaces that are easy to follow and mock for tests.    The BlockPuller creation mechanisms should be converted to a factory struct that receives all the prerequisites except the config-block / join-block, and exposes a method that builds a new BlockPuller given a config block. This allows us to use the same mechanisms for on-boarding, until the join block, and for following past the join-block.    In the block puller, implement a mechanism that updates the block verification policy with every incoming config block. Implement a separate mechanism for updating the endpoints used by the block puller (possibly by creating a new instance).     The follower's function pointer that is used to create a consensus.Chain is replaced by an interface that defines this method. This interface is implemented by the registrar and and is set into the new follower instance at construction time.     """""""		0.9869838	
FAB-14871	FAB	Task	"""Extricate etcdraft consensus parameter validation from the etcdraft consensus plugin"""	"""""""The etcdraft package presently handles all of the parsing and validation of config updates for etcdraft consensus parameters within the etcdraft package itself.    This is very problematic for a number of reasons:    1) This forces etcdraft to re-implement the config update parsing, and there have been several bugs discovered around scenarios where that parsing was actually not being done correctly.  2) There are multiple reconfiguration scenarios, including creating new channels, modifying existing channels, starting up in a bootstrap scenario, where the config must be validated, and all of these cases are currently handled independently (though with some shared code).  3) Finally, the interwoven nature of config processing with the rest of the consensus logic is simply messy and difficult to maintain, and makes understanding the consensus plugin more difficult.    Finally, as we move towards BFT, we will almost definitely need a very similar plug-point for BFT config update validation.  We should be able to convert this processing into a re-usable component acceptable for both."""""""	"""A Pivotal Tracker story has been created for this Issue: https://www.pivotaltracker.com/story/show/165001835"" [SEP] ""https://gerrit.hyperledger.org/r/c/fabric/+/30811/12"""	0.9869042	
FAB-15048	FAB	Story	"""Query enhancements for _lifecycle"""	"""""""Other queries under consideration:   * """"""""That said, we plan to add another query that takes only the sequence number as arguments and returns the full info about the definition with that sequence number, including the list of orgs that have approved it."""""""" [https://gerrit.hyperledger.org/r/c/fabric/+/30340/1/core/chaincode/lifecycle/lifecycle.go#228]"""""""	"""Hi [~<USER> , I have a question: In the old lscc we can get the chaincode package installed on the peer node through the query interface; in the new _lifecycle will we provide a similar one? This type of interface makes it easy for us to audit the chaincode package used by the peer node."" [SEP] ""[~<USER> Ah, yes. Excellent idea! I've created a sub-task to add that functionality."""	0.9868241	
FAB-17414	FAB	Documentation	"""As a chaincode author, I need JSON serialized deterministically"""	"""""""Given the prevalence of JSON in user chaincode, and the criticality of deterministic serialization when saving state in chaincode, users need guidance around deterministic JSON serialization. This is especially true in v2.0 since chaincode may be different across peers, perhaps even implemented in different languages.    Especially problematic is order of JSON elements, since the JSON spec does not guarantee an order. Go Marshal() ([https://golang.org/pkg/encoding/json/#Marshal)] happens to sort map elements, but this is an implementation detail that may change in the future. Javascript ( [https://github.com/nodejs/node/issues/15628|https://github.com/nodejs/node/issues/15628] ) and Java perform no such ordering. And all three languages would certainly produce different results for the same modeled JSON object.    Minimally the concern needs to be well documented. Perhaps some recommendations could be made for using deterministic libraries (e.g. [https://github.com/BridgeAR/safe-stable-stringify/] ). Or perhaps given the prevalence and criticality, the chaincode programming model itself could provide consistent serialization utilities across the languages.     """""""	"""I do not believe that Fabric should provide any canonical JSON serialization libraries at all, but at a minimum we must not put them in the core chaincode libraries.  IMHO, this is just a specific example of the fact that keys and values need to be deterministic across invocations (well technically you might get lucky depending on the endorsement policy)."" [SEP] ""I concur. There is really no end for utility libraries that can be used in Fabric, or Blockchain in general - starting from deterministic JSON marshalling and ending with cryptographic primitives.     I think the right approach is to have these libraries integrated in samples, and people can look at best practices and examples and choose to adopt the approach or use their own."" [SEP] ""Agreed, tagging for doc and samples."""	0.98677886	
FAB-15824	FAB	Story	"""DevOps (scripting) friendly CLI query methods"""	"""""""Fabric CLI provides methods to query the state of the peer and channel, however these methods are not scripting friendly. i.e. it's not easy to process the result without additional fragile tools, like grep, awk, etc.    In particular, implementing following methods will be very useful for automation scripts.    Please see _""""""""Future (Dream) Work""""""""_ section in this [post|https://accenture.github.io/blog/2019/06/25/hl-fabric-meets-kubernetes.html#future-dream-work]. One major step toward that goal will be making channel and chaincode flows declarative, i.e. given the desired state of network, flows will try to reach that state, and following methods will greatly simplify this task.       ||Command||Function||  |peer channel checkexists <channelID>|Check if channel exists, return 0 if exists, 99 o/w|  |peer channel checkjoined <channelID>|Check if peer joined to channel, return 0 if joined, 99 o/w|  |peer channel checkanchors <channelID> <organization>|Check if there is a configtx exists in channel for anchor peers of organization, return 0 if exists, 99 o/w|  |peer chaincode checkinstalled <chaincode name> <version>|Check if certain version of chaincode is installed to peer, return 0 if installed, 99 o/w|  |peer chaincode checkinstantiated <chaincode name> [version] <channelID>|Check if [certain version of] chaincode is instantiated at channel, return 0 if instantiated, 99 o/w|          """""""		0.98675054	
FAB-17848	FAB	Task	"""Add a sample of external chaincode in test-network"""	"""""""*fabric-samples* has a fabcar sample as an external chaincode in *chaincode/fabcar/external*.    This sample is useful for understanding the external chaincode.         However, it may be not easy for Fabric beginners to run the sample with the right settings by only reading the documentation and the instructions in this sample.    I think that the reasons are as follows:   - There are not end-to-end instructions (or tutorials)     - *fabric-samples* does not provide scripts to run the sample directly         Therefore, we propose to add an option to use the above sample to *test-network* to easily try external chaincode features."""""""	"""Before this work is done, I believe we should ensure that the PR which adds an integration test for external chaincode gets merged into Fabric. It appears that the original of the feature and the author of the PR may have lost interest in completing that task.    https://github.com/hyperledger/fabric/pull/552"" [SEP] ""[~<USER>   Thank you for your information.  I see. I would like to wait for this patch to be merged.   """	0.9867452	
